{
  "$schema": "http://json-schema.org/draft-07/schema#",
  "title": "Service Schema",
  "description": "Data schema for service definition files (/content/services/{slug}.json)",
  "type": "object",
  "required": [
    "slug",
    "title",
    "icon",
    "shortDescription",
    "fullDescription",
    "metaDescription"
  ],
  "properties": {
    "slug": {
      "type": "string",
      "description": "URL-friendly slug (must match one of 16 canonical services)",
      "pattern": "^[a-z0-9-]+$",
      "enum": [
        "septic-tank-pumping",
        "septic-tank-cleaning",
        "septic-inspection",
        "real-estate-septic-inspection",
        "septic-tank-repair",
        "emergency-pumping",
        "drainfield-repair",
        "drainfield-replacement",
        "septic-installation",
        "riser-installation",
        "baffle-replacement",
        "septic-tank-locating",
        "camera-inspection",
        "lift-station-service",
        "grease-trap-pumping",
        "septic-system-maintenance"
      ]
    },
    "title": {
      "type": "string",
      "description": "Display name for the service (title case)",
      "examples": ["Septic Tank Pumping", "Drainfield Repair"]
    },
    "icon": {
      "type": "string",
      "description": "Path to icon file (relative to /public, SVG preferred) or emoji",
      "examples": ["/icons/pumping.svg", "ðŸš›"]
    },
    "shortDescription": {
      "type": "string",
      "description": "Brief description for service cards (1-2 sentences, 80-120 characters)",
      "minLength": 50,
      "maxLength": 150,
      "examples": [
        "Regular removal of solid waste to prevent backups and extend system life."
      ]
    },
    "fullDescription": {
      "type": "string",
      "description": "Detailed description (markdown supported, 200-500 words) for service detail page",
      "minLength": 200,
      "maxLength": 3000
    },
    "metaDescription": {
      "type": "string",
      "description": "SEO meta description (150-160 characters)",
      "minLength": 120,
      "maxLength": 160,
      "examples": [
        "Professional septic tank pumping services. Learn what it is, how often to pump, average costs, and how to find a trusted contractor near you."
      ]
    },
    "faqs": {
      "type": "array",
      "description": "Frequently asked questions (3-6 per service)",
      "items": {
        "type": "object",
        "required": ["question", "answer"],
        "properties": {
          "question": {
            "type": "string",
            "description": "Question text (start with interrogative: How, What, Why, When, etc.)",
            "examples": ["How often should I pump my septic tank?"]
          },
          "answer": {
            "type": "string",
            "description": "Answer text (markdown supported, 1-3 sentences)",
            "examples": [
              "Most septic tanks should be pumped every 3â€“5 years, depending on household size, tank capacity, and water usage."
            ]
          }
        }
      },
      "minItems": 3,
      "maxItems": 8
    },
    "relatedServices": {
      "type": "array",
      "description": "Slugs of related services (for cross-linking)",
      "items": {
        "type": "string",
        "pattern": "^[a-z0-9-]+$"
      },
      "minItems": 2,
      "maxItems": 6,
      "examples": [
        ["septic-tank-cleaning", "septic-inspection", "drainfield-repair"]
      ]
    },
    "averageCost": {
      "type": "object",
      "description": "Optional: Pricing information for display",
      "properties": {
        "min": {
          "type": "number",
          "description": "Minimum cost (USD)"
        },
        "max": {
          "type": "number",
          "description": "Maximum cost (USD)"
        },
        "unit": {
          "type": "string",
          "description": "Cost unit (e.g., 'per service', 'per hour')",
          "default": "per service"
        }
      }
    },
    "schema": {
      "type": "object",
      "description": "Additional schema.org properties",
      "properties": {
        "serviceType": {
          "type": "string",
          "description": "Schema.org serviceType",
          "examples": ["Septic Tank Pumping", "Plumbing Service"]
        },
        "category": {
          "type": "string",
          "description": "Service category",
          "examples": ["Maintenance", "Repair", "Installation", "Emergency"]
        }
      }
    }
  },
  "examples": [
    {
      "slug": "septic-tank-pumping",
      "title": "Septic Tank Pumping",
      "icon": "/icons/pumping.svg",
      "shortDescription": "Regular removal of solid waste to prevent backups and extend system life.",
      "fullDescription": "## What Is Septic Tank Pumping?\n\nSeptic tank pumping is the process of removing accumulated solids (sludge and scum) from your septic tank using a vacuum truck. Over time, these solids build up and reduce the tank's effective capacity. If not pumped regularly, solids can overflow into the drainfield, causing system failure and costly repairs.\n\n## Why You Need Regular Pumping\n\n- **Prevent backups:** Full tanks can cause sewage backups into your home\n- **Extend system life:** Regular pumping can add 10-20 years to your system\n- **Avoid drainfield damage:** Solids in the drainfield are expensive to fix\n- **Maintain health standards:** Proper maintenance prevents groundwater contamination\n\n## How It Works\n\n1. Locate the tank access port (we can help if you don't know where it is)\n2. Pump out all liquids and solids using a vacuum truck\n3. Inspect tank condition and baffles\n4. Rinse and backflush if needed\n5. Document service for your records",
      "metaDescription": "Professional septic tank pumping services. Learn what it is, how often to pump, average costs, and how to find a trusted contractor near you.",
      "faqs": [
        {
          "question": "How often should I pump my septic tank?",
          "answer": "Most septic tanks should be pumped every 3â€“5 years, depending on household size, tank capacity, and water usage. Larger households or smaller tanks may need more frequent pumping."
        },
        {
          "question": "How much does septic tank pumping cost?",
          "answer": "Average cost ranges from $300â€“$600, depending on tank size, location, and accessibility. Tanks larger than 1,500 gallons or in hard-to-reach locations may cost more."
        },
        {
          "question": "What happens if I don't pump my septic tank?",
          "answer": "If not pumped regularly, solids can overflow into the drainfield, causing clogs, backups, and system failure. Repairs can cost $5,000â€“$20,000 or more."
        },
        {
          "question": "Can I pump my septic tank myself?",
          "answer": "No. Septic tank pumping requires specialized vacuum equipment and proper disposal of waste at approved facilities. It's also dangerous due to toxic gases. Always hire a licensed professional."
        }
      ],
      "relatedServices": [
        "septic-tank-cleaning",
        "septic-inspection",
        "drainfield-repair",
        "septic-tank-locating"
      ],
      "averageCost": {
        "min": 300,
        "max": 600,
        "unit": "per service"
      },
      "schema": {
        "serviceType": "Septic Tank Pumping",
        "category": "Maintenance"
      }
    }
  ]
}
